506559	Division of Molecular Medicine; Faculty of Medicine Siriraj Hospital, Mahidol University	THA
506560	Kahle Lab; Yale University	USA
506572	Metabolic Disease laboratory; Sheba Medical Center	ISR
506574	Laboratory of Medical Genetics; INSERM	FRA
506575	Medical Genetics Summaries; National Institutes of Health	USA
506576	Hacettepe Genetic Diseases Diagnosis Center; Hacettepe University Faculty of Medicine	TUR
506577	Ali Lab, Centre for Genetic Disorders; Banaras Hindu University	IND
506578	Laboratorio di Genetica e Neuroscienze; Istituto Giannina Gaslini	ITA
506579	Department of Clinical Laboratory; Peking University People's Hospital	CHN
506580	Department of Neurology; Taipei Veterans General Hospital	TWN
506581	U714; CIBER of Rare Diseases	ESP
506582	GeneID Lab - Advanced Molecular Diagnostics	USA
506584	Department of Obstetrics and Gynecology; Montefiore Medical Center	USA
506585	Carola Vinuesa Lab; John Curtin School of Medical Research	AUS
506586	Cancer Molecular Diagnostics Core; Tianjin Medical University Cancer Institute and Hospital	CHN
506588	Bondeson Group; Uppsala University	SWE
506589	MK Azim Lab; Mohammad Ali Jinnah University	PAK
506590	Laboratoire de Genetique Moleculaire; Centre Hospitalier Universitaire de Bordeaux	FRA
506591	Laboratorio de Inmunogenómica y enfermedades metabólicas, Instituto Nacional de Medicina Genómica; Instituto Nacional de Medicina Genómica	MEX
506592	Medical Genetics Lab; Policlinico S. Orsola.Malpighi	ITA
506593	InterGenetics; InterGenetics-Center for Human Genetics and Genomics	GRC
506597	Stephanie Ware Laboratory; Indiana University School of Medicine	USA
506599	Laboratoire de Cytogenetique; Hospices Civils de Lyon	FRA
506601	Department of Respiratory and Critical Care Medicine, Tongji Hospital; Tongji Medical College, Huazhong University of Science and Technology	CHN
506603	Department of Pathology; Brigham And Women's Hospital	USA
506604	Neurogenetics Lab; King Edward Memorial Hospital and Seth Gordhandas Sunderdas Medical College	IND
506607	Medical Cytogenetics and Molecular Genetics Laboratory; IRCCS Istituto Auxologico Italiano	ITA
506608	Center of Medical Genetics; Central South University	CHN
506609	Department of Eugenics & Genetics; Women & Infants Hospital of Zhengzhou	CHN
506610	College of Science, Al Muthanna University; Al Muthanna University	IRQ
506614	Australian Inherited Retinal Disease Registry & DNA Bank; Sir Charles Gairdner Hospital	AUS
506617	Tehran Medical Genetics Laboratory	IRN
506619	Cytogenetics and Genomics Laboratory; Medical University of South Carolina	USA
506620	Neuromuscular Diagnostic Laboratory; American University of Beirut Medical Center	LBN
506621	3DMed Clinical Laboratory Inc	CHN
506624	Klco Lab; St Judes Childrens Research Hospital	USA
506625	Cancer Diagnostics Division; Gene Solutions	VNM
506626	Division of Human Genetics; Cincinnati Children's Hospital	USA
506627	Broad Institute Rare Disease Group; Broad Institute	USA
506628	Pharmacology and Genetics Laboratory; Bauru School of Dentistry, University of Sao Paulo	BRA
506629	Department of Neurology and Neurophysiology; Children's University Hospital	IRL
506631	Consultorio y Laboratorio de Neurogenética; Hospital JM Ramos Mejia	ARG
506632	Wendy Chung Laboratory; Columbia University Medical Center	USA
506633	Genetics Molecular Biology Lab; Hospital Juan P Garrahan	ARG
506634	Genotek; Genotek Ltd.	CAN
506637	Neuromuscular Group; Huashan Hospital, Fudan University	CHN
506639	Clinical Laboratory; Xuzhou Maternity and Child Health Care Hospital	CHN
506640	Marseille Medical Genetics, U1251; Aix Marseille University, Inserm	FRA
506641	Molecular Diagnostics Laboratory; M Health: University of Minnesota	USA
506642	Genetic Laboratory Services; Alberta Children's Hospital	CAN
506643	Division of Genetic Medicine; Lausanne University Hospital	CHE
506644	Raymond Lab; University of Cambridge	GBR
506645	Genomic Medicine Theme, NIHR Oxford Biomedical Research Centre; University of Oxford	GBR
506646	Department of Molecular Diagnostics; Institute of Oncology	SVN
506647	Dept of Genetics; Assistance Publique-Hôpitaux de Paris (APHP) - R DEBRE University Hospital	FRA
506652	Genomics For Life	AUS
506653	Department of Genetics; Sultan Qaboos University Hospital, Oman	OMN
506654	DNA Laboratuvarlari GHTM	TUR
506655	Cancer Variant Interpretation Group UK; Institute of Cancer Research, London	GBR
506656	Institute of Human Genetics; Martin Luther University Halle-Wittenberg	DEU
506657	Laboratory of Molecular Genetics; Shanghai Jiao Tong University School of Medicine and Shanghai Institutes for Biological Sciences	CHN
506659	Department of Pediatrics; Hirosaki University Graduate School of Medicine	JPN
506663	UNC Molecular Genetics  Laboratory; University of North Carolina at Chapel Hill	USA
506665	Zeviani Lab; University of Cambridge	GBR
506666	HSP Biomedical Diagnostics Department; Hospital San Pedro	ESP
506667	Unit of Genetics of Neurodegenerative and Metabolic Disease; Fondazione IRCCS Istituto Neurologico Carlo Besta	ITA
506669	Liping Wei Laboratory; Peking University	CHN
506670	Service de Génétique Médicale; Institut Central des Hôpitaux	CHE
506672	Clinical Genomics Lab; St. Jude Children's Research Hospital	USA
506673	Cancer Genomics Laboratory; Texas Children's Hospital	USA
506674	Department of Internal Medicine, The University of Texas McGovern Medical School; The University of Texas Health Science Center at Houston	USA
506675	Clinical Cancer Genetics and Family Consultants; Athens Medical Center	GRC
506676	Dash Lab; University Health Network	CAN
506678	Pathophysiology of Heart Rhythm Disorders; Université Lyon 1 Claude Bernard	FRA
506679	IRCCS Fondazione Stella Maris; University of Pisa	ITA
506681	Medical Genetics Unit; University of L'Aquila	ITA
506684	Stewart Lab; University of Birmingham	GBR
506686	Department of Endocrinology and Genetic Metabolic Diseases; Children’s Hospital of Chongqing Medical University	CHN
506687	Papaemmanuil Lab; Memorial Sloan Kettering Cancer Research Center	USA
506688	Nalepa Lab; Indiana University School of Medicine	USA
506690	Western Connecticut Health Network; Rudy L. Ruggles Biomedical Research Institute	USA
506691	Institute of Experimental Epileptology and Cognition Research; University of Bonn	DEU
506692	Service de genetique medicale, Pr. Levy; Hopital de La Timone Enfants, APHM	FRA
506694	ClinGen PTEN Variant Curation Expert Panel	USA
506696	Genomic Medicine Lab; University of California San Francisco	USA
506697	Kids Research; The Children's Hospital at Westmead	AUS
506700	Institute of Neurogenomics; Technical University of Munich	DEU
506702	Immunology Clinic; UCLA	USA
506703	GenHotel - European Research Laboratory for Rheumatoid Arthritis; University of Paris Saclay	FRA
506704	Felix Claverie-Martin Laboratory; Hospital Universitario Nuestra Senora de Candelaria	ESP
506705	Human Genetics Laboratory; Faculty of Medicine of Tunis	TUN
506708	Division of Paediatric Endocrinology and Diabetes; University of Luebeck	DEU
506710	Lab. Molecular Oncology; VUB, Free University of Brussels	BEL
506711	Laboratory of Molecular Medicine, Department of Clinical Immunology, Section 7631; University Hospital of Copenhagen, Rigshospitalet	DNK
506712	Research Institute; National Research Institute for Child Health and Development	JPN
506713	GOSgene; University College London Great Ormond Street Institute of Child Health	GBR
506714	Dr. Alfred Bastarche Laboratory; Dr. Georges L. Dumont University Hospital Centre	CAN
506715	Division of Medical Genetics; University of Versailles	FRA
506716	Pediatrics Department; University of Wisconsin	USA
506717	The Raphael Recanati Genetics Institute; Rabin Medical Center	ISR
506718	Human Genetics Group at Institute of Prion Diseases London; University College London	GBR
506722	Laboratory of Medical Genetics; University of Torino	ITA
506724	Reutter Lab, Dept. Of Human Genetics; University of Bonn	DEU
506725	Comparative, Adaptive and Functional Skeletal Biology; CCMAR - University of Algarve	PRT
506726	Department of Laboratory Medicine; Soonchunhyang University Seoul Hospital	KOR
506728	Bio-informatics Data Center; China National GeneBank	CHN
506730	Gharavi Laboratory; Columbia University	USA
506734	Institute of Cell Biology and Neurobiology; Charite-Universitaetsmedizin Berlin	DEU
506736	Knight Cancer Institute; Oregon Health and Science University	USA
506737	Department of Immunology and Histocompatibility; University of Thessaly	GRC
506738	Cole/Wambach Lab; Washington University in St. Louis	USA
506741	Institute of Life Sciences and Biotechnology; Bezmialem Vakif University	TUR
506742	Molecular Biology Laboratory; University of Basrah	IRQ
506743	Department of Urology; The First Affiliated Hospital of Henan University of Traditional Chinese Medicine	CHN
506744	ClinGen Hearing Loss Variant Curation Expert Panel	USA
506749	van Haaften laboratory; University Medical Center Utrecht	NLD
506752	Polak associated Lab; Imagine Institute	FRA
506753	Laboratory of Biochemistry; Caen University Hospital	FRA
506758	International Hereditary Cancer Center PUM; Pomeranian Medical University	POL
506761	Wu Jinyu Laboratory, Institute of Genomic Medicine; Wenzhou Medical University	CHN
506762	Michaelson Lab; University of Iowa	USA
506763	Core Molecular Diagnostic Lab; McGill University Health Centre	CAN
506766	Pediatric Department; The First Affiliated Hospital of Guangxi Medical University	CHN
506769	Hakim Medical Genetics Center Laboratory; Neyshabur University of Medical Sciences	IRN
506771	Pediatric Leukemia/Lymphoma; Memorial Sloan Kettering Cancer Center	USA
506778	Department of Medical Genetics; College of Basic Medicine, Army Medical University	CHN
506779	Institute of Clinical Molecular Biology; Kiel University	DEU
506782	The Division of Genetics and Genomic Medicine; Washington University School of Medicine 	USA
506785	Myelin Disorders Clinic; Children's Medical Center	USA
506786	Genetic Services Unit; National Institute of Biomedical Genomics	IND
506787	Department of Pediatrics and Developmental Biology; Tokyo Medical and Dental University	JPN
506788	Dr Goodarzi Genetics and Genomics Lab	USA
506789	Laboratory of Human Molecular Genetics; Institute of Cytology and Genetics	RUS
506792	Institute for Genomic Medicine (IGM) Clinical Laboratory; Nationwide Children's Hospital	USA
506794	Mayo Clinic Genomics Laboratory; Mayo CLinic	USA
506795	Translational Oncology and Experimental Therapeutics Program-IBMCC; Consejo Superior de Investigaciones Científicas	ESP
506796	Grupo de Pesquisa Clinica e Molecular em Endocrinologia e Metabologia	BRA
506797	Gregorio Maranon General University Hospital; Gregorio Maranon Health Research Institute	ESP
506801	Pathology and Clinical Laboratory Medicine; King Fahad Medical City	SAU
506809	Medical Genetics; American University of Beirut	LBN
506810	Molecular Pathology Diagnostics Labratory; University of Iowa Hospitals & Clinics	USA
506812	Breda Genetics srl	ITA
506814	MutSpliceDB: a database of splice sites variants effects on splicing; NIH	USA
506817	ClinGen CDH1 Variant Curation Expert Panel; ClinGen	USA
506818	Lab of Molecular Oncology; Sapienza University of Rome	ITA
506819	Division of Critical Care, Department of Pediatrics; Cardinal Glennon Children's Hospital	USA
506820	Human Genetics Laboratory; Institute of Biosciences - University of Sao Paulo	BRA
506821	Institute of Human Genetics; Heidelberg University	DEU
506822	University of Malaya Medical Center; University of Malaya	MYS
506823	Johns Hopkins Genomics; Johns Hopkins University	USA
506825	Laboratory of Molecular Genetics; Yakut Science Centre of Complex Medical Problems	RUS
506826	Molecular Dermatology Lab; Tel Aviv Sourasky Medical Center	ISR
506834	University of Washington Department of Laboratory Medicine; University of Washington	USA
506847	Children’s Hospital, Clinical research laboratory; Medizinische Fakultaet Carl Gustav Carus, Technische Universitaet Dresden	DEU
506848	Genitourinary Malignancies Research Center; Cleveland Clinic	USA
506850	Michigan Center for Translational Pathology; University of Michigan	USA
506851	Medical Genetics; Necip Fazil Sehir Hastanesi	TUR
506854	Biologie des Tumeurs Solides; CHU de Montpellier	FRA
506858	Biochemistry and Genetic Laboratory; APHP Bichat Claude Bernard Hospital	FRA
506861	Molecular and Clinical Genetics; Institute of Human Genetics P.A.S.	POL
506863	Institute of Bioinformatics	IND
506870	Department of Rehabilitation Medicine, Incheon St. Mary’s Hospital; College of Medicine, The Catholic University of Korea	KOR
506871	Clinical Genetics; Amsterdam Medical Centre	NLD
506873	Medical Molecular Genetics Department; Human Genetics and Genome Research Division, National Research Centre	EGY
506875	Thoracic Oncology Service; Memorial Sloan Kettering Cancer Center	USA
506876	Routes Lab; Medical College of Wisconsin	USA
506878	Human Cancer Genomic Research; King Faisal Specialist Hospital and Research Center	SAU
506879	Laboratory for Clinical Genomics and Advanced Technology; Dartmouth-Hitchcock Medical Center	USA
506884	Medical Genetic Team; CHRU Montpellier	FRA
506905	Flatmark laboratory; Institute for Cancer Research, Oslo University Hospital	NOR
506908	Department of Medical Genetics; Ahvaz Jundishapur University of Medical Sciences	IRN
506913	Laboratory of Pediatric Immunoinfectivology; Tor Vergata University	ITA
506915	Child Neurology Division, Pediatrics Department; KAHER's Jawaharlal Nehru Medical College, Belagavi	IND
506924	Clinical Genetics; University of Leipzig	DEU
506928	Department of Pediatric Endocrinology; Cukurova University Medical Faculty	TUR
506930	Department of Ophthalmology; Fourth Military Medical University	CHN
506932	Division of Neonatology; National Center for Child Health and Development	JPN
