505974	Kamineni Academy of Medical Sciences & Research Centre; Kamineni Hospitals	IND
505976	Zuffardi lab; University of Pavia	ITA
505977	Neurology Department; Peking University First Hospital	CHN
505978	Tehran Medical Genetics Laboratory (Sciences and Research Branch Islamic Azad University)	IRN
505980	Human Genetics Unit; University of Colombo	LKA
505981	Molecular Genetics and Enzymology; National Research Centre	EGY
505988	Pediatric Highly Intensive Care Unit; Fondazione IRCCS Ca' Granda Ospedale Maggiore Policlinico	ITA
505989	Robarts Research Institute; Western University	CAN
505990	IntelligeneCG	USA
505991	Kasturba Medical College; Manipal University	IND
505993	Daryl Scott Lab; Baylor College of Medicine	USA
505994	Neurogenetics Laboratory - MEYER; AOU Meyer	ITA
505995	Lab of Molecular Dermatology; University Medical Center Freiburg	DEU
505996	Cardiogenetics; Center of Medical Genetics, Antwerp, Belgium	BEL
505997	MVZ Praenatalmedizin und Genetik Nuernberg	DEU
505998	NIHR Bioresource Rare Diseases; University of Cambridge	GBR
505999	Undiagnosed Diseases Network; National Institutes of Health	USA
506000	MacArthur Laboratory (Broad Institute of MIT and Harvard), MacArthur	USA
506004	Heart Center	NLD
506006	Genetics; Medical University of Vienna	AUT
506007	Cytogenetics and Molecular Genetics Section, Pathology Unit,  BARC Hospital; Bhabha Atomic Research Centre	IND
506009	Center for Breast Cancer; National Cancer Center	KOR
506010	A.C.Camargo Cancer Center / LGBM; A.C.Camargo Cancer Center	BRA
506011	Kere lab; Karolinska Institutet	SWE
506012	Rappaport Faculty of Medicine; Technion-Israel Institute of Technology	ISR
506014	Unité de Différenciation Epithéliale et Auto-Immunité Rhumatoïde; INSERM - Université Paul Sabatier	FRA
506015	Clinical Molecular and Personalized Diagnostics; Institute of Biochemistry and Clinical Biochemistry, Teaching and Research Hospital Agostino Gemelli Foundation	ITA
506016	Demoulin lab; University of Louvain	BEL
506018	ARUP Institute; ARUP Laboratories	USA
506019	Department of Orthopeadics and Traumatology; Nanfang Hospital, Southern Medical University	CHN
506020	Human Development and Health; University of Southampton	GBR
506022	Hauner Childrens Hospital, Department of Pediatrics; Dr. von Hauner Children's Hospital; Ludwig Maximilians University	DEU
506023	National Centre for Medical Genetics; Crumlin Children's Hospital, Dublin	IRL
506025	The Molecular Genetic Diagnosis Center; Children’s Hospital of Fudan University	CHN
506030	Centre de Génétique Moléculaire et Chromosomique, Unité de génétique de l'Obésité et des Dyslipidémies; APHP, GH Hôpitaux Universitaires Pitié-Salpêtrière / Charles-Foix	FRA
506035	Heinzen Lab; Columbia University	USA
506036	Pôle de Biologie Pathologie Génétique; CHRU LILLE	FRA
506037	Tim Yu lab; Boston Children's Hospital	USA
506038	Biochimie-Hormonologie; Robert Debre Hospital	FRA
506039	Equipe Genetique des Anomalies du Developpement; Université de Bourgogne	FRA
506041	Hunter Genetics General Clinical Genetics Service; Hunter Genetics	AUS
506042	Molecular Genetics Laboratory; Centre for Cardiovascular Surgery and Transplantation	CZE
506043	Molecular Pathology, SA Pathology	AUS
506044	Division of Medical Genetics; Sainte-Justine Hospital	CAN
506047	The Genetics Institute; Rambam Health Care Campus	ISR
506048	Centre for Molecular Diagnostics & Cell Biology; Rajiv Gandhi Cancer Institute & Research Center	IND
506049	Institute of Basic Medical Sciences; Khyber Medical University, Peshawar	PAK
506051	Zhongshan School of Medicine; Sun Yat-sen University	CHN
506053	Division of Laboratory Medicine and Clinical Genetics; Chiba University Hospital	JPN
506054	Centro de Desenvolvimento Científico e Tecnológico; Secretaria da Saúde do Estado do Rio Grande do Sul	BRA
506055	Biochimie - Maladies Neurologiques Hereditaires	FRA
506058	Groupe Hospitalier Pitie Salpetriere, UF Genomique du Developpement; Assistance Publique Hopitaux de Paris	FRA
506063	Labor Lademannbogen MVZ GmbH	DEU
506064	Genetic Laboratory; Instituto Nacional de Cancer	BRA
506067	Center for Basic Medical Research; TEDA International Cardiovascular Hospital	CHN
506069	Laboratorio de Imunogenetica e Histocompatibilidade; UNIVERSIDADE FEDERAL DO PARANA	BRA
506071	Maesawa Lab; Iwate Medical University	JPN
506072	Oxford Haemato-Oncology Service; Oxford University Hospitals NHS Foundation Trust	GBR
506074	Leeds Institute of Biomedical and Clinical Sciences; University of Leeds	GBR
506075	Muenke lab; National Institutes of Health	USA
506076	Caryl and Israel Englander Institute for Precision Medicine; Weill Cornell Medicine	USA
506077	KK Women’s and Children’s Hospital; KK Women’s and Children’s Hospital	SGP
506078	Department of Genetics; Fundacion Jimenez Diaz University Hospital	ESP
506079	Key Laboratory of Endocrinology; Peking Union Medical College Hospital	CHN
506081	Rady Children's Institute for Genomic Medicine; Rady Children's Hospital San Diego	USA
506086	Human Genetics Institute Leipzig;  Universitätsklinikum Leipzig 	DEU
506087	Center for Medical Genetics and Molecular Medicine; Haukeland University Hospital	NOR
506089	Laboratory of Molecular Biology and Genetics; St Antoine Hospital - APHP	FRA
506091	Gansu Province Medical Genetics Center	CHN
506094	Nöthen Lab, Institute of Human Genetics; University Hospital Bonn	DEU
506095	Molecular Medicine Center; Medical University of Sofia	BGR
506096	The Morris Kahn Laboratory of Human Genetics; Ben-Gurion University of the Negev	ISR
506097	Cancer Prevention Center, Yonsei Cancer Center; Severance Hospital, Yonsei University College of Medicine	KOR
506098	Phosphorus, Inc.	USA
506099	Genome.One	AUS
506100	Department of Animal Sciences; Quaid-i-Azam University	PAK
506102	Akbari laboratory; Tarbiat Modares University	IRN
506103	Mahdieh Medical Diagnostic Center; Falavarjan Branch, Islamic Azad University	IRN
506105	Division of Host Defense; Kyushu University	JPN
506106	Unit for Genetic & Epidemiological Research on Neurological Disorders; Instituto de Investigação e Inovação em Saúde	PRT
506109	Biotechnology Research Center; Pasteur Institute of Iran	IRN
506110	Immunopatologia e Biomarcatori Oncologici/Bio-proteomics facility; Centro di Riferimento Oncologico	ITA
506111	Eone-Diagnomics Genome Center	KOR
506113	Sanfordhealth-Fargo; Sanfordhealth	USA
506115	Embryology Laboratory; Victor Chang Cardiac Research Institute	AUS
506117	Area of Clinical and Molecular Genetics; Hospital Universitario Vall de Hebron	ESP
506118	Endocrine oncology group; Uppsala University	SWE
506119	Laboratoire de Biologie et Génétique du Cancer; Centre François Baclesse	FRA
506120	Applied Translational Genetics Group; University of Auckland	NZL
506122	Kopetz Lab; MD Anderson Cancer Center	USA
506124	FAHD UNIT, Department of Genetics; King Faisal Specialist Hospital and Research Centre	SAU
506125	Medical Genetics Laboratory; Aldo Moro University of Bari	ITA
506128	National Reference Laboratory of Biochemistry; Pasteur Institute of Iran	IRN
506132	Genetic and Metabolic Disease Program, Children's Medical Center Research Institute; UT Southwestern Medical Center at Dallas	USA
506133	Central Research Laboratory; Sri Devaraj Urs Academy of Higher Education and Research	IND
506134	Clinical Genetics; Charité Universitaetsmedizin Berlin	DEU
506136	Herman Laboratory; Nationwide Children's Hospital	USA
506137	Laboratory of Dr Salvatore DiMauro, H. Houston Merritt Clinical Research Center.; Columbia University Medical Center	USA
506140	Columbia University Medical Center; Columbia University	USA
506142	Sandor Lifesciences Pvt Ltd; Sandor Lifesciences Pvt Ltd	IND
506144	Hearing and Balance Clinic; First Affliiated Hospital of Kunming Medical University	CHN
506146	SIB Swiss Institute of Bioinformatics	CHE
506147	UMR-S1161; Institut national de la santé et de la recherche médicale	FRA
506148	Fundacion Publica Galega de Medicina Xenomica; Servicio Galego de Saude	ESP
506149	Biocant - Biotechnology Innovation Center	PRT
506150	Yale Center for Mendelian Genomics; Yale University	USA
506151	Molecular Diagnostic Laboratory; Shanghai Children's Medical Center	CHN
506152	Department of Pathology and Laboratory Medicine; Sinai Health System	CAN
506153	Laboratoires de Diagnostic Génétique; Hôpitaux Universitaires de Strasbourg	FRA
506155	Rampazzo Lab,  Human Molecular Genetics Unit; University of Padua	ITA
506161	ClinGen Inherited Cardiomyopathy Variant Curation Expert Panel	USA
506162	Caglayan Lab; Istanbul Bilim University	TUR
506166	RBHT Clinical Genetics and Genomics Laboratory; Royal Brompton and Harefield NHS Foundation Trust	GBR
506167	Servicio Extremeño de Salud; Hospital de Mérida	ESP
506168	TIDEX; University of British Columbia	CAN
506169	Shworak lab; George Washington University	USA
506171	Wangler Lab; Baylor College of Medicine	USA
506172	Laboratoire de Génétique Moléculaire; CHU Bordeéaux	FRA
506173	Institute of Medical Genetics; University of Zurich	CHE
506174	Geisinger Autism and Developmental Medicine Institute; Geisinger Health System	USA
506177	Department of Pediatrics; Memorial Sloan Kettering Cancer Center	USA
506178	Reichenberger Lab, Center for Regenerative Medicine and Skeletal Development; UConn Health Center	USA
506180	Fundacion Hipercolesterolemia Familiar	ESP
506181	Laboratório Bases Genéticas das Doenças Endocrinológicas, Faculdade de Medicina de Botucatu; Universidade Estadual Paulista	BRA
506183	Cancer Genetics and Genomics Laboratory; British Columbia Cancer Agency	CAN
506184	Department of Laboratory Medicine and Genetics	CAN
506185	GenomeConnect; Clinical Genome Resource	USA
506186	Laboratorium voor Moleculaire Diagnostiek Experimentele Vasculaire Geneeskunde; Academisch Medisch Centrum	NLD
506187	Laboratory of Jean-Laurent Casanova; The Rockefeller University	USA
506188	Department of Pathology and Molecular Medicine; Queen's University	CAN
506189	Iberoamerican FH Network	ESP
506190	Section on Medical Neuroendocrinolgy; National Institutes of Health	USA
506193	Molecular Medicine Research Center; University of Cyprus	CYP
506194	Department of Medical Sciences; Uppsala University	SWE
506195	Molecular Oncology Laboratory; Hospital Clínico San Carlos	ESP
506196	Department of Obstetrics and Gynecology; Helsinki University Hospital	FIN
506198	Department of Laboratory Medicine; Daejeon St. Mary’s Hospital	KOR
506199	Division of Genomics; Kyushu University	JPN
506200	CHLA Center for Personalized Medicine; Children's Hospital, Los Angeles	USA
506201	Limoges University Hospital Laboratory; Limoges University Hospital	FRA
506202	Rare Disease Group, Clinical Genetics; Karolinska Institutet	SWE
506203	AlTemaimi Lab, Faculty of Medicine; Kuwait University	KWT
506204	Zheng Lab; Zhongnan Hospital of Wuhan University	CHN
506205	Yang An-Suei Laboratory; Academia Sinica	TWN
506206	Noncommunicable Diseases Research Center; Fasa University of Medical Sciences	IRN
506207	Laboratoire de Genetique Biologique; CHU de Poitiers	FRA
506208	Noruzinia Laboratory; Tarbiat Modares University	IRN
506209	Medical & Molecular Genetics Group; University of Lincoln	GBR
506210	Immunogenetics Laboratory; Johns Hopkins All Children's Hospital	USA
506211	Snyder Lab, Genetics Department; Stanford University	USA
506212	SIB Swiss Institute of Bioinformatics; Copenhagen University	DNK
506215	Lars Feuk Lab; Uppsala University	SWE
506216	Barrett Group; Wellcome Trust Sanger Institute	GBR
506217	Dept of Molecular Biology and Genetics; Bogazici University	TUR
506218	Institute of Human Genetics Greifswald, Research Division; University Medicine Greifswald	DEU
506219	The Translational Medicine Center of Children Development and Disease; Fudan University	CHN
506220	Flegel Lab; National Institutes of Health	USA
506221	Kariminejad - Najmabadi Pathology & Genetics Center	IRN
506222	Department of Immunology; University Hospital Southampton NHSFT	GBR
506223	Fundació de Recerca de l'Institut de Microcirurgia Ocular	ESP
506224	Genetics Department; University Hospital of Toulouse	FRA
506225	Rizzo Lab; University of Nebraska Medical Center	USA
506228	Genetics of Cognitive Dysfunction Laboratory; I3S-IBMC, University of Porto	PRT
506231	Genomics Laboratory; Virgen de la Arrixaca University Clinical Hospital	ESP
506233	Tolun Lab, Human Genetics Laboratory; Bogazici University	TUR
506234	Institute of Reproductive and Stem Cell Engineering; Central South University	CHN
506235	Obstetrics and Gynaecology Department; Chinese University of Hong Kong	USA
506237	Molecular Laboratory of the Institute of Human Genetics; Galilee Medical Center	ISR
506238	Zhou Lab, Center of Laboratory Medicine; Fuwai Hospital	CHN
506240	School of Basic Medicine; Fourth Military Medical University	CHN
506243	Antonellis Laboratory at Michigan; University of Michigan	USA
506244	Gujarat Genomics Initiative; Gujarat State Biotechnology Mission	IND
506245	Human Molecular Genetics and Metabolic Disorders; Pakistan Institute for Engineering and Applied Science (PIEAS)	PAK
506247	Research Molecular Genetics Laboratory; Women's College Hospital, University of Toronto	CAN
506250	Mitochondrial Research Group; Murdoch Children's Research Institute	AUS
506251	Unit of Genetics and Genomics of Neuromuscular Diseases; Principe Felipe Research Center	ESP
506252	Molecular Biology of the Cell Laboratory; University of Mazandaran	IRN
506254	Genetics of Mitochondrial Diseases; Imagine Institute	FRA
506256	Institute of Endocrinology, Diabetes & Metabolism; Max Healthcare Institute Ltd.	IND
506257	Human Molecular Genetics Laboratory; Federal University of Parana	BRA
506259	Laboratorio de Citogenómica y Microarreglos; Universidad Autonoma de Nuevo Leon	MEX
506260	Center for Medical Genetics; Keio University School of Medicine	JPN
506263	Cirak Lab; University Hospital Cologne	DEU
506266	Pediatric Nephrology (Iijima Lab); Kobe University Graduate School of Medicine	JPN
506270	Department of Traditional Chinese Medicine; Fujian Provincial Hospital	CHN
506271	Neurometabolisches Labor; University hospital Tuebingen	DEU
506272	Molecular ImmunoRheumatology UMRS_1109; Institut national de la santé et de la recherche médicale	FRA
506273	True Health Diagnostics	USA
506275	Centre for Arab Genomic Studies; Sheikh Hamdan Award for Medical Sciences	ARE
506279	Genetics Laboratory; Facudade de Medicina de Sao Jose do Rio Preto	BRA
506280	Human Genomics Unit; Institute for Molecular Medicine Finland (FIMM)	FIN
506281	Division of Hearing and Balance Research; National Hospital Organization Tokyo Medical Center	JPN
506285	Hemoglobin and Genome Lab; University of Campinas	BRA
506286	Cormier-Daire Lab; IMAGINE	FRA
506287	Zi-Jiang Chen Lab; Shandong University	CHN
506289	New Leaf Center	USA
506290	SBielas Lab, Department of Human Genetics; University of Michigan	USA
506293	Lab Thiel (Congenital Disorders of Glycosylation); Center for Child and Adolescent Medicine	DEU
506294	StellarGene Technologies Pvt. Ltd.	IND
506296	Cincinnati Center for Growth Disorders; Cincinnati Children's Hospital Medical Center	USA
506297	Bioinformatics Core; Luxembourg Center for Systems Biomedicine	LUX
506300	Dr. Liu's Molecular Genetics Laboratory; University of Miami Miller School of Medicine	USA
506301	Laboratoire de cytogenetique; Hopital Necker-Enfants Malades	FRA
506302	Wong Mito Lab, Molecular and Human Genetics; Baylor College of Medicine	USA
506306	Hardcastle Lab; UCL Institute of Ophthalmology	GBR
506307	Academic Center for Education, Culture and Research; Motamed Cancer Institute	IRN
506309	GeneID Lab - Advanced Molecular Diagnostics	USA
506311	Anoual Laboratory of Radio-Immuno Analysis	MAR
506312	Dr Meenakshi Bhat Group; Centre for Human Genetics	IND
506313	Laboratory of Molecular Pathology; Fondazione IRCCS Ca' Granda Ospedale Maggiore Policlinico	ITA
506314	Molecular Genetics Laboratory; State University of Campinas	BRA
506315	Department of Hematology - Research Laboratory 1; Postgraduate Institute of Medical Education and Research	IND
506316	David Buchner Laboratory; Case Western Reserve University	USA
506317	Mark LeDoux Lab; University of Tennessee Health Science Center	USA
506318	Dan Cohn Lab; University of California Los Angeles	USA
506319	MAGI'S LAB - Medical Genetics Laboratory; MAGI GROUP	ITA
506321	Emory University School of Medicine, Department of Human Genetics; Emory University	USA
506323	Istenhegyi Gendiagnosztika Kft	HUN
506324	Genetics and Molecular Pathology Laboratory; Hudson Institute of Medical Research	AUS
506325	Xenon Pharmaceuticals, Inc.	CAN
506329	National Molecular Genetics Centre of Cancer Research; N.N. Alexandrov National Cancer Centre of Belarus	BLR
506330	Pediatrie Multidisciplinaire; Assitance Publique des Hopitaux de Marseille	USA
506333	Clinical genetics; CHU Grenoble-Alpes	FRA
506341	Clinical Genetics Group; University of Otago	NZL
506342	Bodamer Research Lab; Boston Children's Hospital	USA
506343	Institute for Genomic Medicine; Nationwide Children's Hospital	USA
506344	Center for Genomics; Ann and Robert H. Lurie Children's Hospital of Chicago	USA
506345	Hunan Clinical Research Center of Ophthalmic Disease; The Second Xiangya Hospital	CHN
506347	Center of Vascular Surgery; The Second Affiliated Hospital of Nanchang University	CHN
506349	Ute Scholl Laboratory; Heinrich Heine University Duesseldorf	DEU
506350	Medical Institute of Bioregulation; Kyushu University	JPN
506352	Tianjin Pediatric Research Institute; Tianjin Children's Hospital	CHN
506353	Computational Biology Unit; University of Bari	ITA
506354	Genomics For Life	AUS
506356	Clinical laboratory, Wuhan Children’s Hospital; Tongji Medical College, Huazhong University of Science and Technology	CHN
506358	Department of Pediatrics; Uniklinik RWTH Aachen	DEU
506359	Department of Laboratory Medicine, Kangbuk Samsung Hospital; Sungkyunkwan University School of Medicine	KOR
506361	Institutes of Biomedical Sciences; Shanxi University	CHN
506362	SickKids Clinical Genetics Group; The Hospital for Sick Children	CAN
506365	GeniaGeo; Laboratorio Genia	URY
506366	Fukami Lab, Dept of Molecular Endocrinology; National Research Institute for Child Health and Development	JPN
506367	Dpt. of Clinical Genetics, Molecular Genetics Lab 4062; University Hospital of Copenhagen, Rigshospitalet	DNK
506368	The Spine Surgery of The First Affiliated Hospital; Sun Yat-sen University	CHN
506369	Cancer Biology Lab; VIT University	IND
506370	Diabetes Molecular Genetics Section, Phoenix Epidemiology and Clinical Research Branch; National Institutes of Health	USA
506371	Edmonton Ocular Genetics; Alberta Health Services	CAN
506372	Yong Feng Lab; Central South University	CHN
506374	Laboratory for Animal Genetics; Ghent University	BEL
506376	Translational Research Program on Neuronal Ceroid Lipofuscinosis; Center for the Study of Inborn Errors of Metabolism	ARG
506377	Department Of Genetics; Lifeline Super Speciality Hospital, Adoor.	IND
506378	Unidade de Bioquimica Genetica; Centro Hospitalar do Porto	PRT
506381	Department of Human Genetics; University Hospital Magdeburg	DEU
506382	Diagnostic Laboratory, Department of Genetics; University Medical Center Groningen	NLD
506387	Medical Molecular Genetics (National Research Centre)	EGY
506392	Laboratory for Cytogenetics and Genome Research; KU Leuven	BEL
506394	Molecular Medicine; University of Leeds	GBR
506396	Genetics Division; Universidade Federal de Sao Paulo	BRA
506400	Research Laboratory, University Department of Zoology; Vinoba Bhave University	IND
506401	Histocompatability and Immunogenetics; National Health Service Blood and Transplant	GBR
506404	Caldovic Lab; Children's National Health System	USA
506405	Lilac Insights Pvt. Ltd.	IND
506406	National AIDS Research Institute; National AIDS Research Institute	IND
506407	Working Group: Pediatric metabolic liver diseases; University Hospital Heidelberg	DEU
506414	Laboratory of Diagnosis and Therapy of Lysosomal Disorders; University of Padova	ITA
506416	Medical Genetics Center; Academic Academic Center for Education, Culture and Research (ACECR), Khorasan Razavi	IRN
506417	Jacobi Internal Medicine Residency Program; Jacobi Medical Center	USA
506418	Degerman lab; Umeå University	SWE
506421	Pediatric Metabolic Diseases; Hacettepe University	TUR
506422	Ambulatório de Genética Médica; Hospital Escola da Universidade Federal de Pelotas	BRA
506423	Department of Endocrinology; Sir Run Run Shaw Hospital	CHN
506428	Medical Genetics Clinic; Mersin Women and Children Hospital	TUR
506429	Tartaglia Lab, Genetics and Rare Diseases Research Division; Bambino Gesu' Children's Hospital	ITA
506433	Omics Laboratory; Stanford University	USA
506435	Unidade de Endocrinologia Genetica - LIM25; Universidade de Sao Paulo (USP)	BRA
506437	Beijing Key Laboratory for Genetic Research of Skeletal Deformity; Peking Union Medical College Hospital	CHN
506438	Clinical Genetics Department; Hospital Sant Joan de Deu	ESP
506439	ClinGen RASopathy Variant Curation Expert Panel	USA
506440	Inherited Neuropathy Consortium	USA
506441	The Genetic Institute, Ha'emek Medical center; Ha'emek Medical Center	ISR
506442	Molecular Diagnostics Laboratory; Nadiya Clinic of Reproductive Medicine	UKR
506444	Children's Hospital of Soochow University; Soochow University	CHN
506451	Department of Hematology; 303rd Hospital of the People's Liberation Army	CHN
506452	Genetics of Infertility and Preimplantation Genetic Diagnosis; Centre Hospitalier Universitaire Grenoble Alpes	FRA
506453	Genome Diagnostics Laboratory; VU University Medical Center Amsterdam	NLD
506454	Genomic Medicine Laboratory; University of Vermont Medical Center	USA
506455	Dental Genetics Laboratory; Seoul National University School of Dentistry	KOR
506458	Epi4K Consortium	USA
506460	Warsaw Genomics; University of Warsaw	POL
506470	Center of Excellence in Medical Genetics Research; Chiang Mai University	THA
506471	Molecular Neuropsychiatry & Development Lab; Centre for Addiction and Mental Health	CAN
506472	University of Uludag Hospital, Genetic Diseases Diagnostic Center; University of Uludag	TUR
506473	Piracicaba Dental School; University of Campinas	BRA
506476	Clinical Bioinformatic Lab; Royan Institute	IRN
506477	Center of Endocrinoloy; The First Hospital of Shanxi Medical University	CHN
506479	Department of Pathology and Genetics; University of Gothenburg	SWE
506486	Molecular Development Laboratory; Murdoch Childrens Research Institute	AUS
506488	Service de Pédiatrie - Neurologie et infectiologie - Toulouse; CHU de Toulouse - Hôpital des Enfants	FRA
506493	Department of Paediatric Medicine; Post Graduation Institute of Medical Education and Research	IND
506497	DNA and Cytogenetics Diagnostics Unit; Erasmus Medical Center	NLD
506498	Laboratory of Genetics and Genomics; Cincinnati Children's Hospital Medical Center	USA
506499	Pediatric Genomics Discovery Program; Yale University	USA
506500	Laboratory of Immunology and Cellular Biotechnologies; Immanuel Kant Baltic Federal University	RUS
506501	Medical Genetics Laboratory; University of Pavia	ITA
506502	Carson lab; Ohio State University Comprehensive Cancer Center	USA
506506	Laboratory of Molecular Neuropathology; The University of Texas Health Science Center at Houston	USA
506507	Hwa Lab, Division of Endocrinology, Cincinnati Children's Hospital Medical Center; University of Cincinnati College of Medicine	USA
506510	Pfaffle Lab, University Hospital for Children and Adolescents; University of Leipzig	DEU
506512	Seattle Children's Hospital Molecular Genetics Laboratory; Seattle Children's Hospital	USA
506513	Tampere Brain Tumor Research Consortium; University of Tampere	FIN
506514	Amyloidosis Center; Boston University School of Medicine	USA
506516	Division of Hematology/Oncology, Florida; Mayo Clinic	USA
506517	Biochemical Molecular Genetic Laboratory; King Abdulaziz Medical City	SAU
506519	Paediatric Endocrinology - Genetics and Genomic Medicine Program; University College London - Great Ormond Street Institute of Child Health	GBR
506520	Department of Genetic, Henri Mondor Hospital; Assistance Publique des Hôpitaux de Paris	FRA
506521	Familial Cancer Clinical Unit; Spanish National Cancer Research Centre (CNIO)	ESP
506523	Arora Lab; Fox Chase Cancer Center	USA
506524	Laboratory of Molecular Genetics,Brain Korea 21 PLUS Project for Medical Sciences; Yonsei University College of Medicine	KOR
506525	Precision Medicine Oncology; Rutgers Cancer Institute of New Jersey	USA
506527	Department of Medical Bioinformatics; Sinopath Diagnosis	CHN
506529	Schule lab; Hertie Institute for Clinical Brain Research	DEU
506530	Pediatric Immunology Service; The Chaim Sheba Medical Center at Tel HaShomer	ISR
506531	Department of Biochemistry; Shiraz University of Medical Sciences	IRN
506532	Molecular Genetics Laboratory, Faculty of Medicine; Prince of Songkla University, Thailand	THA
506534	SingHealth Duke-NUS Institute of Precision Medicine; SingHealth	SGP
506535	Institute of Human Genetics; Polish Academy of Sciences	POL
506536	Guangdong Provincial Key Laboratory of South China Structural Heart Disease; Guangdong Cardiovascular Institute	CHN
506539	Clinical Genetics Laboratory; Harran University	TUR
506542	Hb Lab, Kinderklinik Ulm; University Hospital Ulm	DEU
506543	Dept. of Medical Genetics; Telemark Hospital Trust	NOR
506545	Center for Precision Medicine; Vanderbilt University Medical Center	USA
506546	Weiss Lab; University of Miami	USA
506548	Otorhinolaryngology Lab - LIM32; University of Sao Paulo School of Medicine Clinics Hospital	BRA
506551	Institute for Biomedicine; Eurac Research	ITA
506552	Medical Genetics; Hospital Clinico Universitario Virgen de la Arrixaca	ESP
506554	Fan Lab; Zhengzhou University	CHN
506555	Gill Bejerano Lab; Stanford University	USA
506556	The Danek Gertner Institute of Human Genetics; Sheba Medical Center	ISR
506557	Magee Womens Research Institute; University of Pittsburgh Medical Center	USA
506558	ClinGen PAH Variant Curation Expert Panel; ClinGen	USA
